"You must destroy the Democratic leaders who are fighting to win the war, prostrate them, and then walk over and get the spoils of office. | 0

President, with great interest all that is being done here in the city of Washington to get 'a big crowd to attend the inaugural ceremonies. | 0

And, too, this was the first war in which 1930 6657  our country took part after the great war between the States, and we rejoice to see the sons of those who wore the blue and the sons of those who wore the gray march together under the Star-Spangled Banner to the splendid tunes of the North and the splendid tunes of the South, which have become the tunes of America. | 0

These once proud and upstanding American farmers have been driven into these industrial cities. | 0

It is all for the United States of America which is going to live we hope for thousands of years. | 0

I admire the Senator's magnificent oration just now; but I want to say that yesterday he was defending this little crowd of a few thousand that have made his own people poor, that have brought on the distress of his own people in New York; and he said they paid 30 per cent of the taxes, when that very crowd of people ought to be paying 50 per cent. | 0

How is the gentleman going to get the salute into the RECORD. | 0

My children do that; they do not have to do It, but we are very proud because they do do it. | 0

Chairman, I am proud to be able to say to the men of this House that a majority of my constituents are black men, and I am glad to be here to speak in their behalf. | 0

Chairman and colleagues, Kentucky is justly proud of the thrilling victory of the Ashland Tom Cats in the recent national basketball tournament held in Chicago, and it was my privilege to ride in the fire truck witht the Ashland team in the splendid celebration given them by their home city Easter Sunday morning, when an estimated crowd of 10, 000 lined the streets to welcome the triumphant victors. | 0

In other words, the Senator from Maryland is sure that the man who stayed at home and robbed the wives and mothers and dependents of the soldiers who went abroad to fight for America were entirely to be commended, and their rights should be protected, while the soldiers who served in the Army and Navy are to be condemned and their rights spLrrned. | 0

These patriotic Americans who sent their boys with our flag across the sea to fight and to die if need be for the American Government are now coming in the hour of their business, distress, and affliction and asking that same Government -to deliver them out of the hands of those who are robbing them of the fruits of tieir toil. | 0

Well do I remember when President Hoover was in there and the mayor of the great city of Detroit came to Washington to plead for help for the thousands of hungry and homeless people of that great metropolis and the people of Michigan. | 0

No Member of this House has ever had a more loyal backing from home than I have, and I am proud of them and I hope they will always be proud of me. | 0

I have gone into many of these rural districts and fought this battle out, and if you were to leave the word "person" in here, it would give one man in a community an opportunity to get the money to build a line to his house and leave his neighbors out, and the power companies will go to this man and tell him to do that and say, "Why should you help to carry these poor fellows along", which would put them in the Same position as the neighbors of the gentleman from New York, who gets no power at all, while the gentleman enjoys such power, even though he does not know what the rates are. | 0

There are idle, starving men in your cities who now watch the rural carriers because they are the Government employees . | 0

And I know that it is well that all interests should be represented here, but it is fortunate that at this particular time there are enough men in the Senate and in the House who will hear the cry of these men, to whom we owe a debt of gratitude we can never pay, and will see that they do not go away from their Government empty-handed. | 0

I am told that this bill will injure the farmers of the country, the farmers whose sons trudge into the mills of the city, the farmers whose children have replenished the ranks of the workers of America. | 0

Are you, as a member of the town council of the city of Washington going to say to-night that the people of this city for whom you speak, can not spend their own money , and not be permitted to give labor to their own folks. | 0

An uncle of mine marched forward in the face of the shells at Gettysburg, and I am proud of it. | 0

The people of Virginia took a walk in 1928; so did the people of North Carolina; so did the people of Tennessee; so did the people of Kentucky; so did the people of Texas; and so did the people of Oklahoma, all Democratic States. | 0

If the gentleman wants to do something progressive for democracy, for the American people, he will favor and urge legislation for a decent salary for these men who represent us in foreign countries, and then we can send men abroad who are not multimillionaires. | 0

I can say to my colleagues in the Senate that the people of that State today join with the entire Nation in paying this tribute of honor to their native son and one of the great heroes of this war. | 0

For the past several months it has been my privilege to toil night and day in its behalf. | 0

Salutes and encomiums do not feed the hungry, do not rebuild homes, and do not restore freedom. | 0

Now, here is an American city in Minnesota-a fine upstanding community of good, God-fearing American people-the business center of that city destroyed, homes wrecked by cyclone and storm. | 0

Mr Speaker, scarcely a day passes that several young men, splendid young Americans, do not drop into my office and pay me a personal visit as they come from my district in upstate New York down to the great training camps of the South. | 0

It is truly a great organization of which we are all proud in my district. | 0

Before the Congress recesses for the summer I am going to try to bring that legislation to the floor of the House, in order that we may protect these veterans who have been protecting us, in order that those men who have served on the firing line may come home and work without paying tribute for the privilege of doing so. | 0

I have sons who are eligible to carry the arms of their country today, and I am not a warmonger, and I am not going to vote for war that will send my boys or the Senator from Missouri's boy into war unless it is America's war; and I will turn my back upon my boys in shame if they turn their backs upon the flag of their country that my grandfather fought and died for and I offered my life for in 1917 and 1918. | 0

If I ever join the retirement fund, I will pay the back money or I never will join. | 0

I was accosted, as were so many others in those days, when we walked out into a great city, by hundreds of beggars, men who had been industrious workingmen, but who were sacrificing their dignity to ask for 5 or 10 cents for a cup of coffee. | 0

My purpose is to move to proceed to the consideration of the joint resolution  to provide for the publication and distribution of a supplement to the Revised Statutes. | 1

The resolution was considered by unanimous consent, and agreed to, as follows: Resolved, That the resolution adopted hy the Senate June 8, 1882, relating to the adjustment of certala land grants be construed so as to allow the Secretary of the lutel cr to furnish the information therein asked for at his discretion, taking into account the other necessary work in the General Land Office. | 1

The Senator from New York consents to the modification, and the amendment will be so modified. | 1

The gentleman from Pennsylvania makes a request requiring unanimous consent. | 1

By unanimous consent, the proposed amendment will be read for the information of the House. | 1

WoLLsJ and I suggest that it would be well to have that additional authority, or the resolution conferring it, read for the information of the House. | 1

The amendment will be reported as modified. | 1

Pending that, by unanimous consent, the Chair will present some requests. | 1

I am instructed by the Committee on Printing, to which was referred the joint resolution  providing for additional copies of the Revised Statutes for the use of the Interior Department, to report it without amendment, and I ask for its present consideration. | 1

" Mr WILSON, of Iowa. | 1

From the Committee on Rules and Administration, I report favorably without additional amendment, Senate Resolution 223, and I ask unanimous consent for its present consideration. | 1

But inasmuch as last year's bill required the preparation of a definite plan and report, to be submitted to the States and to be approved by Congress, it will not be necessary. | 1

There being no objection, the Senate proceeded to consider the joint resolution  making additional appropriations for the Department of Agriculture for the fiscal year 1954, and for other purposes, which had been reported from. | 1

I ask the Senator if he would object to specific language requiring the carriers to file detailed supporting data at the time they make their request for an interim increase. | 1

President, do I correctly understand the RECORD will show that the unanimous-consent request offered by the junior Senator from Nebraska was modified to include the request of the Senator from Virginia . | 1

The House, however, considers the proviso to be too broad in scope, and prefers that more restricted language be submitted as a budget estimate in regular procedure. | 1

Mr President, in order that the committ6e's action and in order that the resolutions of ratification may be better understood, and especially that the effective dates of these conventions be clearly stated, I ask unanimous consent that there be included in the RECORD at this point the analysis of the pending conventions and committee recommendations, under title III, page 3, of the committee report, to the end thereof. | 1

In order that Senators may readily ascertain the subject matter and general provisions of each of the titles of the committee amendments, there has been included in the supplemental report of the committee, at pages 18 through 20, a brief summary of the provisions of each title. | 1

President, I incorporate in my unanimous-consent request the provision that at the conclusion of the consideration of the two conference reports the Senator from Washington may be permitted to address the Senate for 5 minutes, before the Senate proceeds to the call of the calendar. | 1

With that brief preliminary statement, I ask unanimous consent that the committee amendments be considered and agreed to en bloc; and that the bill, as thus amended, be considered for the purpose of amendment as original text; provided, however, that no point of order against any amendment shall be deemed to have been waived by the adoption of this agreement. | 1

President, reserving the right to object, and I do not plan to object, does the proposed unanimous-consent request contain a provision as to the time allowed on amendments. | 1

I wish to say further, in that regard, that at the conclusion of section 4 of the resolution, to which the Senator from New Hampshire has referred, it is specified that additional information shall be contained in an authorization. | 1

The proposal of the Senator will require unanimous consent. | 1

President, reserving the right to object, will the Senator from Montana include in his unanimousconsent request an additional request that such an arrangement shall not effect any change in the pending business, which is the motion to take up these resolutions. | 1

Speaker, when the bill authorizing approval of compact between the States of New Jersey, Pennsylvania, New York, Delaware, and the United States was called on the Consent Calendar, I announced that an application for a rule had been made for consideration of that bill; therefore, the motion will not be made. | 1

The Chair also advises the Senator that if the unanimous-consent request is denied, the Senator from Montana may offer his modification as an amendment to the pending amendment. | 1

If the unanimous-consent request is objected to, the order of business before the Senate will be the first amendment that has been proposed by the committee. | 1

There being no further requests for time, pursuant to the rule, the Clerk will now read the substitute amendment of the committee, reported in the bill, which for the purpose of amendment shall be considered under the 5-minute rule as an original bill. | 1

Unanimous consent is required for this resolution to be considered because it has not been formally reported by the committee. | 1

The new language includes provisions for a periodic review of the adequacy of this amount authorized for irrigation assistance and for recommendation by the Secretary of any changes that may be needed. | 1

The Chair will inform the gentleman that there Is pending a request that the Eckhardt amendment be modified, and without objection the Chair will ask the Clerk to read the amendment as it would be offered pursuant to the unanimous consent request of the gentleman from Texas (Mr. | 1

I have already modified the amendment to include such language as requested by the Senator from Texas. | 1

And that the bill as thus amended be regarded for purposes of amendment as original text, providing that no point of order shall be considered to have been waived by reason of agreement to this unanimous-consent request. | 1

The assistant legislative clerk read as follows: The Senator from Louisiana  proposes a modification to his amendment numbered 253. | 1

And a time limitation includes modifying your own amendment without unanimous consent request. | 1

The House conferees have agreed to modifications and clarifications of the House amendments which I believe render the bill acceptable as an interim measure pending a complete review of the Bank's activities and authority. | 1

The unanimous-consent request made by the Senator from Massachusetts is modified in accordance with the language proposed by the Senator from New York. | 1

The Chair will read the provision of the rule, paragraph 3: No request by a Senator for unanimous consent for the taking of a final vote on a specified date upon the passage of a bill or joint resolution shall be submitted to the Senate for agreement thereto until, upon a rollcall ordered for the purpose by the Presiding Officer, it shall be disclosed that a quorum of the Senate Is present. | 1

In addition, this amendment specifies that the report contain "such recommendations as the committee finds necessary to establish a program. | 1

But if the unanimous-consent request is modified to include my request, I will have no objection. | 1

Would the gentleman from California tell us which items in the appropriation in addition to those specific ones he enumerated would be covered by this waiver of requiring an authorization prior to appropriations. | 1

Is the gentleman from Pennsylvania revising his unanimous-consent  request  to  limit the amendments to title III to the ones specified by the gentleman from Ohio. | 1

This is not a request for additional authorization but it is rather an amendment to provide $200, 000 for a study under the pending current authorization. | 1

Mr President, in the case of interstate transfer grants, which were specifically earmarked by the conferees on House Joint Resolution 357, the further reductions in this agreement shall be applied on a pro rata basis to the base as specified in the joint explanatory statement of the managers on House Joint Resolution 357. | 1

The provision the Senator is questioning that relates to the Interior Department takes the conference report on Interior and related agencies that is pending before both Houses and adopts it by reference for the purpose of providing guidance on the expenditure of the sums that may be necessary in this interim period. | 1

The Clerk will report the amendment, as modified, as requested by the gentleman from California . | 1

The Clerk will report the proposed amendment as modified by the unanimous consent request. | 1

No, clearly it is not, in that it clearly does not require a specific authorization and line item authorization, which my substitute would require him to obtain. | 1

Does the gentleman from Texas include the second matter in his unanimous-consent request to permit Mr JEFoDOus to offer two modified amendments to be offered to titles III and IV by Mr DE  Is there objection to the request of the gentleman from Texas. | 1

President, the request should be modified further as follows: the Weicker-Dixon amendment containing technical and conforming amendments to the bill to the relevant provisions of the DOD bill as passed by the Senate. | 1

The Clerk read as follows:  Modification to amendment in the nature of a substitute offered by Mr Young of Alaska: On page 6, line 11, after ``use'', insert ``, subject to the relevant reprogramming guidelines of the House and Senate Committees on Appropriations''. | 1

The amendment , as modified, is as follows:  On page 23, strike line 18 through line 6 on page 25 and insert the following: `` provides that if for any fiscal year the responsible Federal agency determines that there are insufficient appropriations to provide for the estimated direct costs of the mandate, the Federal agency shall  notify the appropriate authorizing committees of Congress of the determination and submit legislative recommendations for either implementing a less costly mandate or making the mandate ineffective for the fiscal year; `` provides expedited procedures for the consideration of the legislative recommendations referred to in item  by Congress not later than 30 days after the recommendations are submitted to Congress; and `` provides that the mandate shall cease to be effective 60 days after the date the legislative recommendations of the responsible Federal agency are submitted to Congress under item  unless Congress has completed action on the recommendations during the 60 day period. | 1

Rather, I believe it is appropriate to publish the legislative language so that necessary clarifications or technical modifications can be Identified and accommodated prior to the committee's official reporting of these provisions to the House Budget Committee in September. | 1

Rule XLIX requires the enrolling clerk, upon adoption of the budget resolution conference report, to prepare a joint resolution changing the statutory limit on the public debt if necessary to conform to amounts in the budget resolution. | 1

President, I ask unanimous consent that the prior unanimous-consent agreement regarding the foreign operations appropriation bill be modified to include an amendment by Senator KASSEBAUM regarding Morocco. | 1

The clerk has not received the modification which the Senator from Arkansas has indicated that he might consider making to his previously submitted amendment. | 1

It is my understanding that there was no provision to that effect at that time and that this is now being included in this unanimous-consent request at the request of the Senator from Arizona. | 1

modifications to certain amendments printed in House report 104-483   Is there objection to the request of the gentleman from California. | 1

In addition, Mr Speaker, this resolution provides additional debate time on the following specified amendments. | 1

After a period of questioning, the subcommittee adopted an amendment approving Chairman HAMILTON'S request for $1, 350, 000 and limiting the amount available for the procurement of consultant services to $950, 000. | 1

I ask unanimous consent to waive all provisions of the Budget Act and budget resolutions necessary for the consideration of the pending amendment to this bill and for the inclusion of the language of the pending amendment in the consideration of one amendment between the Houses--an amendment. | 1

If I could also clarify the language of the unanimous consent request, the last paragraph reads, ``Each additional amendment may be offered only by the Member designated in this request. | 1

I ask unanimous consent to modify my request to include the Warner amendment. | 1

President, I ask unanimous consent to waive all provisions of the Budget Act and budget resolutions necessary for the consideration of the pending amendment to this bill, and for the inclusion of the language of the pending amendment in the consideration of an amendment between Houses. | 1

Do I understand the unanimous consent request calls for specific amendments after the pending amendment is voted on. | 1

The objection is heard to both the modification and the original unanimous-consent request. | 1

President, I ask unanimous consent to modify my EDI amendment    to   include  the  three projects, Washington, Nebraska, and Rhode Island. | 1

I ask unanimous consent to modify my request to include the Warner amendment. | 1

Is there objection to the additional unanimous consent request. | 1

I ask unanimous consent to waive all provisions of the Budget Act and budget resolutions necessary for the consideration of the pending amendment to this bill and for the inclusion of the language of the pending amendment in the consideration of one amendment between the Houses-an amendment. | 1

Speaker, is it not correct procedure in the House of Representatives for the purpose, when a Member offers a unanimous consent request, that the objection be heard after the conclusion of the unanimous consent request. | 1

The assistant legislative clerk read as follows: The Senator from Pennsylvania , for himself and Mr DURBIN, proposes an amendment numbered 101, as modified, to amendment No. | 1

President, under the prior unanimous consent agreement, I call up my amendment numbered 1237, as modified. | 1

Speaker, it\'s my understanding that pursuant to rule XXVIII of the Rules of the House, upon adoption of the conference report on the budget by both the House and the Senate, the Clerk of the House will be instructed to prepare a joint resolution adjusting the public debt limit; is that correct. | 1

If there is no objection to the request as modified, it is so ordered. | 1

The assistant legislative clerk read as follows:  The Senator from Arizona , for himself, Mr Bennett, Mr Roberts, and Ms Snowe, proposes an amendment numbered 2301, as modified. | 1

The Senate has the ability to review, debate, and vote in relation to any item, whether it is included in this measure as bill language or just identified in report language. | 1

Would the unanimous consent request of the Senator from California modify the existing unanimous consent. | 1

Madam President, I ask unanimous consent that the following amendments be in order to be called up and that they not be subject to modification or division, with the exception of the technical modifications to the Merkley and Paul amendments contained in this agreement: Manchin No. | 1

Is there objection to the unanimous consent request, as modified. | 1

I understand that a specific appropriation is required. | 1

If the object of the provision of the pending bill which has just been read by the Clerk and against which the point of order is made is to authorize any of the specific amounts provided in the several clauses of the bill to be used for other objects or purposes than those there designated, then it does change existing law and the point of order is well taken. | 1

The resolution will be amended so as to conform to the request of the Senator from Vermont, that the substitute report shall be printed instead of the original report. | 1

Is there objection to the request of the gentleman from South Carolina to consider this bill as a substitute for the one reported from the committee. | 1

The gentleman from California consents to the modification of his resolution, and it will be read as modified. | 1

The Chair will state to the gentleman front Kansas  that from an examination of the law establishing the geological survey he finds that the bill under consideration in its limitations follows the precise language of the original law, and that the amendment proposed to be inserted would extend the scope of this bill beyond the provisions of the original law, and is therefore not in order. | 1

Another question: After the previous question has been ordered, would it be in order for me to move that the consideration of all rules of the Forty-ninth Congress in regard to which the Committee on Rules has not recommended a modification be postponed till the first Wednesday in January. | 1

. They have therefore submitted the substitute which proposes a special committee for the purpose of making this inquiry. | 1

The amendment now under consideration is not an appropriation; therefore that portion of the rule does not apply. | 1

