" It maybe possible that some of the subsequent provisions may modify their plan. | 1

If such a provision is adopted, it should be included in some subsequent appropriation bill. | 1

It is understood that I made the point of order that the conferees have exceeded their jurisdiction in this matter, and that therefore the conference report can not be received. | 1

The Chair will state that one item included in the point of order made by the Senator from Kentucky the Chair is required under the rule to submit to the Senate. | 1

Without objection, the bill will be reported with the recommendation that the title be amended. | 1

436   The Clerk will read the amendment proposed by the gentleman from Pennsylvania, after which the Chair will submit the request for unanimous consent. | 1

The question is, Is the amendment proposed by the Senator from Nevada to the amendment reported by the committee in order under Rule XVI. | 1

The gentleman from Illinois modifies his reques. | 1

Is there objection to the present consideration of the resolution as modified. | 1

The gentleman from Missouri offers an amendment to the pending paragraph, to which the gentleman from Illinois makes the point of order that it is not in order because of the provisions of Rule XXI, section 2, which reads: No appropriation shall be reported in any general appropriation bill, or bo in order as an amendment thereto, for any expenditure not previously authorized by law, unless in continuation of appropriations for such public works and objects as are already in progress; nor shall any provision changing existing law be in order in any general appropriation bill or in any amendment thereto. | 1

Is there objection to the present consideration of the resolution as proposed to be modified. | 1

The Chair would like to ask the gentleman from Illinois if he understands that the amendment is exactly for the same purpose as that specified in the pending paragraph. | 1

I understand it is a limitation on this appropriation, but if the Senator objects to it, and it is general legislation, I will modify it by saying that" no part of this appropriation shall be used by any. | 1

I should like to modify that resolution by inserting the word "requested" for the word "instructed; " so as to make it a request to the committee. | 1

Without objection, the Clerk will report the proposed amendment of the gentleman from Massachusetts  as amended by the amendment of the gentleman from New York . | 1

The gentleman from Massachusetts offers a modification of the amendment, which the Clerk will report. | 1

The first question to determine, therefore, is whether or not the expenditures included in this paragraph have been previously authorized by lmIw. | 1

Without objection, it will be so modified, and the Clerk will report the amendment as it will read. | 1

This amendment proposes to appropriate money which under the existing law has been appropriated for a specific purpose for a specific year. | 1

MANN] examined the current military appropriation bill to ascertain whether or not that language is not carried in the current law under another paragraph or in another part of the bill. | 1

LACEY] modify his request for unanimous consent. | 1

The Secretary read as follows: In submitting these reports the department made no recommendation, and as the entire record, which appeared to contain all the Information necessary to enable Congress to determine the measure of relief which should be extended, is before Congress, I am not in a position to make any specific recommendations. | 1

Is there objection to the request of the gentleman from Washington, Mr JoriNsoN, as modified by the request of the gentleman from Washington, Mr BRYAN. | 1

The gentleman modifies his request, limiting the time to five days after the completion of the bill. | 1

The gentleman from Illinois asks unanimous consent to submit a modification of his amendment, which the Clerk will report. | 1

This is the rule: No request by a Senator for unanimous consent for the taking of a final votc on a specified date upon the passage of a bill or joint resolution shall be submitted to the Senate for agreement thereto until, upon a roll call ordered -for the purpose by the presiding officer, it shall be disclosed that a quorum of the Senate is present. | 1

In this and the preceding paragraph the committee adopted the recommendations of the department, including the number of clerks required for the service, the promotions, and the amount of money to carry on the service; in other words, it has not changed the estimates made by the department. | 1

The statute of May 28, 1896, provides: That the total amount appropriated In the various paragraphs of an appropriation act shall be determined by the correct footing up of the specific sums or rates appropriated In each paragraph, unless otherwise expressly provided. | 1

The gentleman from New York asks unanimous consent to make a modification, which the Clerk will report. | 1

The bill is being read now, as the Chair is informed, for amendment, and therefore the request of the gentleman is not in order. | 1

Does the Senator from Georgia, In his proposed unanimous-consent agreement, specify the calendar day. | 1

Is there objection to the request of the gentleman from Alabama to so modify his amendment. | 1

Is there objection to the request that the amendment be modified. | 1

Is there objection to the request of the gentleman from Kentucky to modify his amendment. | 1

Speaker, I desire to call up the report of the Select Committee on Expenditures in the War Department and ask for the reading of the report under the 3328  rule, and pending that I would like to ascertain by agreement with the gentleman representing the minority, if possible, whether it is not possible to obviate the reading of the tabulated part attached to the minority report. | 1

There is no amendment proposed to the paragraph which I am  discussing relative to any specific rate incorporated by the House. | 1

Unanimous consent has been requested to present the resolution, and it is directed to be read in order that the Chair may ascertain whether there is objection. | 1

" All of those are preliminary and necessary to each one of the other separate provisions, and included in it as one of these is the provision " within the limit of amounts appropriated therefor. | 1

Is there objection to the request of the gentleman from Kentucky for the modification of his amendment. | 1

paragraph 3, it is provided tlhtNo request by a Senator for unanimous consent for the taking of a final vote on a specified date upon the passage of a bill or joint resolution shall be submitted to the Senate for agreement thereto until, upon a roll call ordered for the purpose by the Presiding Oflicer, it shall be disclosed that a quorum of the Senate Is present. | 1

The Chair has just stated that the pending question is on inserting Title I1I, as recommended by the committee. | 1

In the meantime the Chair would direct the attention of the gentleman from Maryland to this question: The language in the text of the pending bill appropriates not to exceed $33, 000 for personal services in the District of Columbia in accordance with the classification act of 1923. | 1

Chairman, I ask unanimous consent that the clerk of the committee be authorized to change any and all totals to conform with amendments made by the committee during the consideration of the bill. | 1

My understanding of the proviso Is that it was intended to establish the paragraph on such a basis that in the event of a direction by Congress or a resolution passed by Congress for the printing of documents by the Department of Agriculture the cost of printing the documents would be covered by a special appropriation and not taken out of the fund carried in this item. | 1

In 1922 there were four of them requested, in 1923 three were requested, and an additional number is still pending. | 1

In other words, there is no additional authority given under the pending bill. | 1

Paragraph 4 of Rule XXI, provides as follows: No bill or joint resolution carrying appropriations shall be reported by any committee not having jurisdiction to report appropriations, nor shall an amendment proposing an appropriation be in order during the consideration of a bill or joint resolution reported by a committee not having that jurisdiction. | 1

The Treasury thereupon reported that the present language in the law, with the insertion of the additional language provided in the amendment offered by the committee to make it harmonize with the provisions of the second section, should be substituted in lieu of the matter now in the bill. | 1

I inquire if the provision which is to be reported by the conferees relating to the flexible tariff is available now for the use or study of the Senate. | 1

The Clerk will again report the amendment as modified by the unanimous-consent request of the gentleman from Illinois. | 1

The Clerk will report the amendment as modified for the information of Members. | 1

Now it is proposed by the Senator from New York to meet the objection by specifying the appropriation. | 1

The inquiry, which I now address to the Senator, is whether his amendment may not be included among the specified limiting items on page 3 of the joint resolution, rather than as a qualification of the broad purposes designed to be covered by the joint resolution. | 1

Not after the amendment Is agreed to; but the Chair may say the unanimous-consent request does not include the Cochran amendment. | 1

Subsection       of section 403 reads as follows: Prepare and submit studies, reports, and recommendations upon matters within its jurisdiction under this act for presentation to the President and the Congress, or upon the request of the President or the Congress. | 1

I will read the letter from the Secretary on this subject, so that Senators will understand the object of the amendment: Your secretary over the telephone to-day requested the assistance of this bureau in drafting a provision to be incorporated In the pending appropriation bill for the Interior Department removIng the present requirement of law requiring contracts with an irrigation district, and providing that payment of certain amounts should be made within 30 years instead of 40 years. | 1

Speaker, I object to both requests, the modified request and the original request. | 1

That provision was included in my request, I may say to the gentleman from Colorado. | 1

Speaker, in view of the importance of the deficiency bill, I modify my request and will ask unanimous consent that the gentleman may proceed for 5 additional minutes. | 1

Chairman, I ask unanimous consent that the committee amendments be agreed to, with the understanding that the point of order may not be made against subsequent amendments to be offered to change the amount of the allocation, and then we can consider them en bloc. | 1

The unanimous-consent request was to return to section 4 for the purpose of considering an amendment on page 5, as indicated, and therefore the gentleman from Wisconsin  is recognized and the amendment will be reported by the Clerk. | 1

There being no objection, the memorandum was ordered to be printed in the RECORD, as follows: That the conferees' amendment to Amendment No 42 to House Joint Resolution 208 be further amended so as to strike out the words "the Administrator and the Extension Services in the respective States" and substitute therefor the words "any Federal agency, " and so as to place a period after the words "War Department" and to delete the words next following, which read "in order to assure that the terms of such treaties or international agreements are complied with. | 1

The paragraph reads: This bill makes it possible for the Committee on Appropriations and the Congress to provide funds for aid to China just as soon as specific recommendations are presented by the Department of State, which Secretary Marshall has indicated will be before the Congress convenes in regular session in January 1948. | 1

Paragraph  of section 2 of the report is the same as in bill passed by Senate  in that bill), except for clarifying limitations with respect to Commission's power to authorize a reorganization plan, even if required percentages of approval have not been received. | 1

Speaker, I ask unanimous consent for the present consideration of the bill  to amend the act approved May 27, 1937 , by providing substitute and additional authority for the prevention of speculation in lands of the Columbia Basin project and substitute any additional authority related to the settlement and development of the project, and for other purposes, and pending that I ask unanimous consent that the bill may be considered in the House as in Committee of the Whole. | 1

This, strictly speaking, is not a limitation on an appropriation bill, but rather, as I submit to the Chair, is new legislation and therefore not in order here. | 1

Is there objection to the request of the gentleman from Virginia that the proposed amendments be reported for information. | 1

I ask unanimous consent to take from the Speaker's table the bill  to amend the act approved May 27, 1937, by providing substitute and additional authority for the prevention of speculation of lands of the Columbia Basin project, and substitute and additional authority related to the settlement and development of the project, with Senate amendments, disagree to the Senate amendments, and ask for a conference. | 1

Therefore, under the language of the House amendment, any funds appropriated prior to the date of the approval of this bill would be included in the limitation of $1, 300, 000, 000. | 1

In accordance with my interpretation of rule XVI, the committee has recommended an increase in that amount; but if I understand and have the proper construction of rule XVI, any amendment offered from the floor still further to increase the amount recommended by the Committee on Appropriations would be subject to a point of order. | 1

Chairman, I have no objection to modifying my request as indicated by the gentleman from Mississippi, and ask unanimous consent that my request be considered as so modified. | 1